{
  "title": "Neue Studio",
  "slug": "neue-studio",
  "category": "creative-studios",
  "summary": "A polished premium studio landing page prompt built with carefully specified typography, media, and layout.",
  "source_file": "NEUE.md",
  "builderstudio_url": "https://builderstudio.dev/",
  "usage": "Copy the contents of prompt.md and paste it into BuilderStudio for a one-shot run.",
  "tags": [
    "creative-studios",
    "builderstudio",
    "one-shot",
    "prompt"
  ],
  "seeded": true
}
