{
  "title": "Qumica Software Hero",
  "slug": "qumica-software-hero",
  "category": "saas",
  "summary": "A high-performance software company hero section prompt focused on speed, clarity, and conversion.",
  "source_file": "ROCKET.md",
  "builderstudio_url": "https://builderstudio.dev/",
  "usage": "Copy the contents of prompt.md and paste it into BuilderStudio for a one-shot run.",
  "tags": [
    "saas",
    "builderstudio",
    "one-shot",
    "prompt"
  ],
  "seeded": true
}
