{
  "title": "Securify Data Security",
  "slug": "securify-data-security",
  "category": "saas",
  "summary": "A full-screen data security SaaS hero section prompt for trust-forward product marketing.",
  "source_file": "SECURE.md",
  "builderstudio_url": "https://builderstudio.dev/",
  "usage": "Copy the contents of prompt.md and paste it into BuilderStudio for a one-shot run.",
  "tags": [
    "saas",
    "builderstudio",
    "one-shot",
    "prompt"
  ],
  "seeded": true
}
