{
  "title": "Ratw Hero Section",
  "slug": "ratw-hero-section",
  "category": "travel-luxury",
  "summary": "A highly polished responsive HTML hero section prompt with background video and staged animations.",
  "source_file": "RATW.md",
  "builderstudio_url": "https://builderstudio.dev/",
  "usage": "Copy the contents of prompt.md and paste it into BuilderStudio for a one-shot run.",
  "tags": [
    "travel-luxury",
    "builderstudio",
    "one-shot",
    "prompt"
  ],
  "seeded": true
}
