{
  "title": "Orbis.Nft",
  "slug": "orbis-nft",
  "category": "fintech-web3",
  "summary": "A dark space-themed NFT landing page prompt with liquid glass treatment and video-driven sections.",
  "source_file": "ORBIS.md",
  "builderstudio_url": "https://builderstudio.dev/",
  "usage": "Copy the contents of prompt.md and paste it into BuilderStudio for a one-shot run.",
  "tags": [
    "fintech-web3",
    "builderstudio",
    "one-shot",
    "prompt"
  ],
  "seeded": true
}
