{
  "title": "3D Creator Portfolio",
  "slug": "3d-creator-portfolio",
  "category": "portfolio",
  "summary": "A one-shot prompt for building a dark 3D creator portfolio for Jack using React, TypeScript, Tailwind CSS, Framer Motion, and Lucide React.",
  "source_file": "3D.md",
  "builderstudio_url": "https://builderstudio.dev/",
  "usage": "Copy the contents of prompt.md and paste it into BuilderStudio for a one-shot run.",
  "tags": [
    "portfolio",
    "builderstudio",
    "one-shot",
    "prompt"
  ],
  "seeded": true
}
