{
  "title": "Full Screen Hero",
  "slug": "full-screen-hero",
  "category": "components",
  "summary": "A reusable full-screen hero section prompt using React, Tailwind CSS, Framer Motion, and Lucide React.",
  "source_file": "HERO.md",
  "builderstudio_url": "https://builderstudio.dev/",
  "usage": "Copy the contents of prompt.md and paste it into BuilderStudio for a one-shot run.",
  "tags": [
    "components",
    "builderstudio",
    "one-shot",
    "prompt"
  ],
  "seeded": true
}
