{
  "title": "Travel Cinematic Hero",
  "slug": "travel-cinematic-hero",
  "category": "travel-luxury",
  "summary": "A cinematic travel-oriented hero section prompt built as a single responsive HTML experience.",
  "source_file": "TRAV.md",
  "builderstudio_url": "https://builderstudio.dev/",
  "usage": "Copy the contents of prompt.md and paste it into BuilderStudio for a one-shot run.",
  "tags": [
    "travel-luxury",
    "builderstudio",
    "one-shot",
    "prompt"
  ],
  "seeded": true
}
