{
  "title": "RIVR DeFi Dashboard",
  "slug": "rivr-defi-dashboard",
  "category": "fintech-web3",
  "summary": "A glassmorphism DeFi hero prompt for sleek fintech and web3 product presentation.",
  "source_file": "DEFI.md",
  "builderstudio_url": "https://builderstudio.dev/",
  "usage": "Copy the contents of prompt.md and paste it into BuilderStudio for a one-shot run.",
  "tags": [
    "fintech-web3",
    "builderstudio",
    "one-shot",
    "prompt"
  ],
  "seeded": true
}
